<?xml version="1.0" encoding="windows-1251"?>
<!--
  ~ org.riverock.portlet - Portlet Library
  ~
  ~ Copyright (C) 2006, Riverock Software, All Rights Reserved.
  ~
  ~ Riverock - The Open-source Java Development Community
  ~ http://www.riverock.org
  ~
  ~
  ~ Licensed under the Apache License, Version 2.0 (the "License");
  ~ you may not use this file except in compliance with the License.
  ~ You may obtain a copy of the License at
  ~
  ~      http://www.apache.org/licenses/LICENSE-2.0
  ~
  ~ Unless required by applicable law or agreed to in writing, software
  ~ distributed under the License is distributed on an "AS IS" BASIS,
  ~ WITHOUT WARRANTIES OR CONDITIONS OF ANY KIND, either express or implied.
  ~ See the License for the specific language governing permissions and
  ~ limitations under the License.
  -->
<MemberArea xmlns:xsi="http://www.w3.org/2001/XMLSchema-instance" xsi:noNamespaceSchemaLocation="C:\sandbox\riverock\riverock-portlet\src-schema\xsd\riverock-portlet-member.xsd" xmlns:portlet="http://java.sun.com/xml/ns/portlet/portlet-app_1_0.xsd">
	<Module name="mill.stat.useragent" authApplication="MILL.STAT" authModule="MILL.STAT.USER_AGENT" isDelete="true">
		<Content action="index">
			<security-role-ref>
				<role-name>webmill.admin</role-name>
			</security-role-ref>
			<Title isUseProperties="false">
				<StringData>Список используемых юзер агентов</StringData>
			</Title>
			<QueryArea>
				<PrimaryKey>ID_SITE_USER_AGENT</PrimaryKey>
				<PrimaryKeyType>number</PrimaryKeyType>
				<MainRefTable>a</MainRefTable>
				<Fields refTable="a" name="ID_SITE_USER_AGENT" dbType="NUMBER" jspType="int_text" isShow="true">
					<NameColumn isUseProperties="0" storage="mill.locale.HAM_QSO_LOG">
						<StringData>##</StringData>
					</NameColumn>
				</Fields>
				<Fields refTable="a" name="USER_AGENT" dbType="VARCHAR" length="150" jspType="text" isShow="true">
					<NameColumn isUseProperties="0" storage="mill.locale.HAM_QSO_LOG">
						<StringData>UserAgent</StringData>
					</NameColumn>
				</Fields>
				<Table table="WM_PORTAL_ACCESS_USERAGENT" ref="a"/>
				<Order field="ID_SITE_USER_AGENT" direction="ASC"/>
			</QueryArea>
			<TargetAreaName isUseProperties="false">
				<StringData>Type of action</StringData>
			</TargetAreaName>
			<TargetModule action="index">
				<TargetModuleName isUseProperties="0">
					<StringData>Index page</StringData>
				</TargetModuleName>
			</TargetModule>
		</Content>
	</Module>
</MemberArea>
